uid;slug;titre;description;date_debut;date_fin;horaires;dates_texte;lieu_nom;adresse;code_postal;commune;latitude;longitude;categorie;gratuit;image_url;url_source;agenda_source;date_extraction
19424536;lecture-creative-a-savigny-sur-braye;Lecture créative à Savigny-sur-Braye;Votre médiathèque s'anime ! Lecture créative à Savigny-sur-Braye. Une lecture d'album, prolongée par un atelier créatif : 1 livre + 1 atelier. A partir de 5 ans.;2026-03-27;2026-05-26;23:00–22:59;27 mars - 26 mai;Médiathèque-Ludothèque Agora Braye;7 Rue Hélène Boucher, 41360 Savigny-sur-Braye;41360;Savigny-sur-Braye;47.880414;0.807572;Stages et ateliers;;https://cdn.openagenda.com/main/;;Territoires Vendômois;2026-04-07
82892405;marche-de-la-vallee-de-ronsard-a-couture-sur-loir;Marché de la Vallée-de-Ronsard à Couture-sur-Loir;Mettez vos sens en éveil grâce à ce marché ! Marché de la Vallée-de-Ronsard à Couture-sur-Loir. Chaque 2ème et 4ème dimanche de chaque mois, venez rencontrer des producteurs et commerçants locaux : bi;2026-03-21;2026-05-20;23:00–22:59;21 mars - 20 mai;Centre bourgCentre bourgCouture-sur-Loir;41800 Vallée-de-Ronsard;41800;Vallée-de-Ronsard;47.754122;0.687352;Marché;;https://cdn.openagenda.com/main/;;Territoires Vendômois;2026-04-07
20382385;concours-les-couleurs-du-temple-et-du-perche;"Concours "" Les Couleurs du Temple et du Perche""";"Tous à vos appareils ! Concours "" Les Couleurs du Temple et du Perche"". Vous êtes invités à immortaliser des images de notre environnement, qu’il s’agisse de paysages, d’architecture, ou encore de mis";2026-03-02;2026-05-01;23:00–22:59;2 mars - 1 mai;Le Temple;Place du Temple, 41170 Le Temple;41170;Le Temple;47.932304;0.935233;Photographie;;https://cdn.openagenda.com/main/;;Territoires Vendômois;2026-04-07
9515797;concours-photos-point-de-vue-insolite;"Concours photos : ""Point de vue insolite""";"Tous à vos appareils ! Concours photos : ""Point de vue insolite"". Révélez le patrimoine méconnu de notre territoire : capturez ses détails insolites, ses curiosités inattendues et ses secrets bien gar";2026-03-01;2026-04-30;23:00–22:59;1 mars - 30 avril;Vendôme;47 Rue Poterie, 41100 Vendôme;41100;Vendôme;47.793092;1.065706;Photographie;;https://cdn.openagenda.com/main/;;Territoires Vendômois;2026-04-07
34865556;la-jeunesse-bouquine-en-vendomois;La jeunesse bouquine en Vendômois;Au mois d'avril le réseau des médiathèques de Territoires Vendômois vous propose une série de manifestations autour de la littérature de jeunesse. La jeunesse bouquine en Vendômois. Au mois d’avril, l;2026-04-01;2026-04-30;00:00–23:59;1 - 30 avril;Dans les médiathèque du Vendômois;41100 Vendôme;41100;Vendôme;47.797799;1.059645;Littérature;;https://cdn.openagenda.com/main/;;Territoires Vendômois;2026-04-07
40472208;la-jeunesse-bouquine-exposition-mission-potager-2054638;"La Jeunesse bouquine ! - Exposition ""Mission potager""";"La Jeunesse bouquine ! - Exposition ""Mission potager""";2026-03-31;2026-04-25;00:00–23:59;31 mars - 25 avril;Médiathèque de Vendôme;Parc Ronsard, 41100 Vendôme;41100;Vendôme;47.792608;1.065549;Exposition;;;;Territoires Vendômois;2026-04-07
47425901;atelier-couture-a-selommes;Atelier couture à Selommes;Venez découvrir les techniques de couture tout en réalisant vos propres créations dans une ambiance conviviale et inspirante. Atelier couture à Selommes. L'atelier de couture propose une expérience cr;2026-03-27;2026-04-25;23:00–22:59;27 mars - 25 avril;Médiathèque17 bis;rue Bout de Haies, 41100 Selommes;41100;Selommes;47.753757;1.192781;;;https://cdn.openagenda.com/main/;;Territoires Vendômois;2026-04-07
77141834;heure-du-conte-a-selommes;Heure du conte à Selommes;Petites histoires et grandes émotions. Heure du conte à Selommes. Installez-vous confortablement, laissez votre imagination s'envoler et préparez-vous à découvrir une histoire merveilleuse où les rêve;2026-03-27;2026-04-25;23:00–22:59;27 mars - 25 avril;Médiathèque17B;Rue du Bout des Haies, 41100 Selommes;41100;Selommes;47.75543;1.1925;;;https://cdn.openagenda.com/main/;;Territoires Vendômois;2026-04-07
61464861;partage-de-lecture-a-vendome;Partage de lecture à Vendôme;"Moment de partage ""littéraire"" dans votre médiathèque. Partage de lecture à Vendôme. Vous cherchez des idées de livres à lire ? Vous aimeriez partager vos coups de cœur ? Venez nous retrouver pour un";2026-03-26;2026-04-24;23:00–22:59;26 mars - 24 avril;MédiathèqueMédiathèque;Rue Poterie, 41100 Vendôme;41100;Vendôme;47.792556;1.065475;Littérature;;https://cdn.openagenda.com/main/;;Territoires Vendômois;2026-04-07
5064399;mentalisme-au-gite-de-vendome;Mentalisme au Gîte de Vendome;Vous profiterez du spectacle en petit comité (18 places maximum) pour une convivialité idéale. Mentalisme au Gîte de Vendome. Découvrez le spectacle de mentalisme Remue Méninges « ORIGINES » de Xavier;2026-02-20;2026-04-21;23:00–22:59;20 février - 21 avril;Vendôme;56 Rue du Change, 41100 Vendôme;41100;Vendôme;47.793569;1.067608;Festivals | concerts et spectacles;;https://cdn.openagenda.com/main/;;Territoires Vendômois;2026-04-07
82950689;heure-du-conte-a-vendome;Heure du conte à Vendôme;Moment de détente dans votre médiathèque. Heure du conte à Vendôme. Laissez vous conter de belles histoires à partir de 4 ans suivi d'un atelier créatif.;2026-03-03;2026-04-15;23:00–22:59;3 mars - 15 avril;MédiathèqueParc Ronsard;41100 Vendôme;41100;Vendôme;47.792591;1.065581;Conférences | soirées contes;;https://cdn.openagenda.com/main/;;Territoires Vendômois;2026-04-07
1016169;heure-du-conte-a-naveil;Heure du conte à Naveil;Un moment à partager dans votre médiathèque. Heure du conte à Naveil. Installez-vous confortablement et laissez-vous emporter par la magie des mots… Petits et grands sont invités à tendre l’oreille po;2026-02-10;2026-04-11;23:00–22:59;10 février - 11 avril;Point lecture;16 Rue de la Condita, 41100 Naveil;41100;Naveil;47.794053;1.029927;Conférences | soirées contes;;https://cdn.openagenda.com/main/;;Territoires Vendômois;2026-04-07
20332423;prokino-a-vendome;Prokino à Vendôme;35ème semaine du cinéma de langue allemande. Prokino à Vendôme. Depuis 35 ans, PROKINO fait découvrir le cinéma de langue allemande, mêlant films récents et classiques, souvent inédits en France. Pend;2026-04-06;2026-04-10;00:00–23:59;6 - 10 avril;Cinéma Majestic Vendôme;2 Rue Darreau, 41100 Vendôme;41100;Vendôme;47.802699;1.069413;Cinéma;;https://cdn.openagenda.com/main/;;Territoires Vendômois;2026-04-07
25530267;cine-media-3235229;Ciné-média;Ciné-média;2026-04-07;2026-04-07;00:00–23:59;Mardi 7 avril, 00h00;Médiathèque de Vendôme;Parc Ronsard, 41100 Vendôme;41100;Vendôme;47.792608;1.065549;Projection;;;;Territoires Vendômois;2026-04-07
26456824;cine-media-4931941;Ciné-média;Ciné-média;2026-04-07;2026-04-07;00:00–23:59;Mardi 7 avril, 00h00;Médiathèque de Vendôme;Parc Ronsard, 41100 Vendôme;41100;Vendôme;47.792608;1.065549;Projection;;;;Territoires Vendômois;2026-04-07
51784188;cine-media-a-montoire-sur-le-loir;Ciné-média à Montoire-sur-le Loir;Pause cinéma à la médiathèque de Montoire-sur-le Loir ! Ciné-média à Montoire-sur-le Loir. Un moment convivial pour les curieux d’image et de récit, amateurs ou passionnés, à vivre ensemble dans l’uni;2026-04-07;2026-04-07;00:00–23:59;Mardi 7 avril, 00h00;Médiathèque Nef EuropaQuartier Marescot;41800 Montoire-sur-le-Loir;41800;Montoire-sur-le-Loir;47.751889;0.861139;Cinéma;;https://cdn.openagenda.com/main/;;Territoires Vendômois;2026-04-07
76759680;cine-media-a-savigny-sur-braye-4271532;Ciné-média à Savigny-sur-Braye;Votre médiathèque vous propose la projection d'un film récent sur grand écran. Ciné-média jeunesse à Savigny-sur-Braye. Plongez dans un univers cinématographique captivant, où chaque image raconte une;2026-04-07;2026-04-07;00:00–23:59;Mardi 7 avril, 00h00;Médiathèque-Ludothèque Agora Braye;7 Rue Hélène Boucher, 41360 Savigny-sur-Braye;41360;Savigny-sur-Braye;47.880414;0.807572;Cinéma;;https://cdn.openagenda.com/main/;;Territoires Vendômois;2026-04-07
81104708;petit-concert-du-mardi;Petit concert du mardi;Petit concert du mardi (tous les instruments) par l'École de musique des Territoires Vendômois.;2026-04-07;2026-04-07;00:00–23:59;Mardi 7 avril, 00h00;Auditorium;41800 Montoire-sur-le-Loir;41800;Montoire-sur-le-Loir;47.754799;0.864217;Musique;;;;Territoires Vendômois;2026-04-07
4586738;atelier-creatif-a-selommes-2616236;Atelier créatif à Selommes;Invite la mer dans une bouteille… Atelier créatif à Selommes. Viens créer ton mini océan, un monde bleu qui danse aux creux des mains, sous forme de bouteille sensorielle. A partir de 6 ans. Jusqu’à 1;2026-04-08;2026-04-08;00:00–23:59;Mercredi 8 avril, 00h00;Médiathèque17 bis;rue Bout de Haies, 41100 Selommes;41100;Selommes;47.753757;1.192781;;;https://cdn.openagenda.com/main/;;Territoires Vendômois;2026-04-07
11336511;bb-bouquine-a-savigny-sur-braye-271236;BB Bouquine à Savigny-sur-Braye;"Les bébés à l'honneur ce matin à la médiathèque-ludothèque de Savigny-sur-Braye. BB Bouquine à Savigny-sur-Braye. BB bouquine ""Les sens"" temps d’accueil des enfants de 0 à 3 ans.";2026-04-08;2026-04-08;00:00–23:59;Mercredi 8 avril, 00h00;Médiathèque-Ludothèque Agora Braye;7 Rue Hélène Boucher, 41360 Savigny-sur-Braye;41360;Savigny-sur-Braye;47.880414;0.807572;Littérature;;https://cdn.openagenda.com/main/;;Territoires Vendômois;2026-04-07
18540587;spectacle-la-vie-en-couleur-a-savigny-sur-braye;"Spectacle ""La vie en couleur"" à Savigny-sur-Braye";"Par la compagnie Balala... Spectacle ""La vie en couleur"" à Savigny-sur-Braye. Ce spectacle propose aux tout petits une découverte sensible du monde qui les entoure : chaque couleur évoque un objet ou";2026-04-08;2026-04-08;00:00–23:59;Mercredi 8 avril, 00h00;Médiathèque-Ludothèque Agora Braye;7 Rue Hélène Boucher, 41360 Savigny-sur-Braye;41360;Savigny-sur-Braye;47.880414;0.807572;Festivals | concerts et spectacles;;https://cdn.openagenda.com/main/;;Territoires Vendômois;2026-04-07
35564993;la-jeunesse-bouquine-atelier-creatif-9260711;La Jeunesse bouquine - Atelier Créatif;La Jeunesse bouquine - Atelier Créatif;2026-04-08;2026-04-08;00:00–23:59;Mercredi 8 avril, 00h00;Médiathèque de Vendôme;Parc Ronsard, 41100 Vendôme;41100;Vendôme;47.792608;1.065549;Atelier;;;;Territoires Vendômois;2026-04-07
60202986;la-jeunesse-bouquine-bb-bouquine-541361;La Jeunesse bouquine - BB Bouquine;La Jeunesse bouquine - BB Bouquine;2026-04-08;2026-04-08;00:00–23:59;Mercredi 8 avril, 00h00;Médiathèque de Vendôme;Parc Ronsard, 41100 Vendôme;41100;Vendôme;47.792608;1.065549;Heure du conte;;;;Territoires Vendômois;2026-04-07
79756323;la-jeunesse-bouquine-spectacle-la-vie-en-couleur-9046639;"La Jeunesse bouquine - Spectacle ""La vie en couleur""";"La Jeunesse bouquine - Spectacle ""La vie en couleur""";2026-04-08;2026-04-08;00:00–23:59;Mercredi 8 avril, 00h00;Médiathèque de Vendôme;Parc Ronsard, 41100 Vendôme;41100;Vendôme;47.792608;1.065549;Spectacle;;;;Territoires Vendômois;2026-04-07
86025255;heure-du-conte-4779286;Heure du conte;Heure du conte;2026-04-08;2026-04-08;00:00–23:59;Mercredi 8 avril, 00h00;Médiathèque de Vendôme;Parc Ronsard, 41100 Vendôme;41100;Vendôme;47.792608;1.065549;Heure du conte;;;;Territoires Vendômois;2026-04-07
76502178;atelier-vivant-a-la-maison-botanique;Atelier vivant à la Maison Botanique;Viens jouer dans la nature ! Vacances 100% nature. Atelier vivant à la Maison Botanique. Notre Centre de Loisirs propose aux enfants de 3 à 13 ans des activités de découverte du patrimoine naturel et;2026-02-16;2026-04-16;07:30–17:00;16 février - 16 avril;Maison Botanique;8 Rue des Écoles, 41270 Boursay;41270;Boursay;48.01833;0.96891;;;https://cdn.openagenda.com/main/;;Territoires Vendômois;2026-04-07
91344417;rejoignez-volabraye-votre-prochaine-mission-dinterim-vous-attend-avec-start-people-7323385;Rejoignez Volabraye : votre prochaine mission d'intérim vous attend avec Start People !;Participez à une session de recrutement organisée par Start People pour découvrir les opportunités de missions d'intérim chez Volabraye à Savigny-sur-Braye ! De nombreux postes d'ouvriers agro-alim;2026-04-08;2026-04-08;09:30–11:00;Mercredi 8 avril, 09h30;Vendôme - Agence VENDOME;41100 Vendôme, 41100 Vendôme;41100;Vendôme;47.787418;1.071736;['#TousMobilisés' | 'Recrutement'];;https://cdn.openagenda.com/main/;;Territoires Vendômois;2026-04-07
92177080;qui-a-sabote-les-chocolats;Qui a saboté les chocolats ?;En famille, vivez une aventure de Pâques au cœur de la ville... À l’occasion de Pâques, les familles vont adorer cette nouvelle enquête Randoland ! Un circuit pédestre en 8 étapes, au cœur de Vendôme;2026-04-04;2026-05-02;10:00–16:30;4 avril - 2 mai;Vendôme;47 Rue Poterie, 41100 Vendôme;41100;Vendôme;47.793092;1.065706;Pâques;;https://cdn.openagenda.com/main/;;Territoires Vendômois;2026-04-07
24902151;la-jeunesse-bouquine-exposition-le-livre-dans-tous-ses-etats-5158680;"La Jeunesse Bouquine - Exposition ""Le livre dans tous ses états""";"La Jeunesse Bouquine - Exposition ""Le livre dans tous ses états""";2026-04-01;2026-04-30;10:00–18:00;1 - 30 avril;Médiathèque de Vendôme;Parc Ronsard, 41100 Vendôme;41100;Vendôme;47.792608;1.065549;Exposition;;;;Territoires Vendômois;2026-04-07
32157736;la-jeunesse-bouquine-avril-2026-un-mois-dedie-a-la-litterature-de-jeunesse;La Jeunesse bouquine ! - Avril 2026 : un mois dédié à la littérature de jeunesse;La Jeunesse bouquine ! - Avril 2026 : un mois dédié à la littérature de jeunesse;2026-04-01;2026-04-30;10:00–18:00;1 - 30 avril;Médiathèque de Vendôme;Parc Ronsard, 41100 Vendôme;41100;Vendôme;47.792608;1.065549;;;;;Territoires Vendômois;2026-04-07
47383464;la-jeunesse-bouquine-exposition-les-petits-mythos-2125796;"La Jeunesse bouquine ! - Exposition ""Les Petits Mythos""";"La Jeunesse bouquine ! - Exposition ""Les Petits Mythos""";2026-04-01;2026-04-30;10:00–18:00;1 - 30 avril;Médiathèque de Vendôme;Parc Ronsard, 41100 Vendôme;41100;Vendôme;47.792608;1.065549;Exposition;;;;Territoires Vendômois;2026-04-07
31344298;la-jeunesse-bouquine-fresque-participative-1402279;La Jeunesse bouquine - Fresque participative;La Jeunesse bouquine - Fresque participative;2026-04-01;2026-04-29;10:00–18:00;1 - 29 avril;Médiathèque de Vendôme;Parc Ronsard, 41100 Vendôme;41100;Vendôme;47.792608;1.065549;Exposition;;;;Territoires Vendômois;2026-04-07
93773927;protegeons-les-oceans-3072033;Protégeons les océans;Protégeons les océans;2026-03-25;2026-04-25;09:00–12:00;25 mars - 25 avril;Médiathèque de Vendôme;Parc Ronsard, 41100 Vendôme;41100;Vendôme;47.792608;1.065549;Exposition;;;;Territoires Vendômois;2026-04-07
56789298;la-jeunesse-bouquine-malle-coups-de-coeur;La Jeunesse bouquine ! - Malle coups de coeur;La Jeunesse bouquine ! - Malle coups de coeur;2026-04-01;2026-04-11;10:00–13:00;1 - 11 avril;Médiathèque de Vendôme;Parc Ronsard, 41100 Vendôme;41100;Vendôme;47.792608;1.065549;;;;;Territoires Vendômois;2026-04-07
51504238;artistes-du-vendomois-a-la-chapelle-st-jacques-de-vendome;Artistes du Vendômois à la Chapelle St Jacques de Vendôme.;Exposition des Artistes du Vendômois à la Chapelle St Jacques de Vendôme. Exposition des Artistes du Vendômois à la Chapelle St Jacques de Vendôme. Jean-Pierre Renard, peintre et sculpteur - Neumi Dud;2026-04-03;2026-04-12;14:00–19:00;3 - 12 avril;Vendôme;47 Rue Poterie, 41100 Vendôme;41100;Vendôme;47.793092;1.065706;Exposition;;https://cdn.openagenda.com/main/;;Territoires Vendômois;2026-04-07
10792857;vos-allocations-conseils-actualisation-paiement-on-vous-dit-tout-166221;VOS ALLOCATIONS : conseils, actualisation, paiement, on vous dit tout !;Vous vous posez des questions sur vos allocations, l'actualisation ou la reprise d'emploi ? Cette réunion vous permet d'y voir clair, simplement et concrètement, sur vos démarches à France Travail.;2026-04-08;2026-04-08;14:30–15:15;Mercredi 8 avril, 14h30;Vendôme - Agence VENDOME;41100 Vendôme, 41100 Vendôme;41100;Vendôme;47.787418;1.071736;"[""S'informer""]";;https://cdn.openagenda.com/main/;;Territoires Vendômois;2026-04-07
69914142;exposition-les-petits-mythos-a-montoire-sur-le-loir;Exposition « Les petits Mythos » à Montoire-sur-le Loir;Entrez dans les coulisses de la BD « Les Petits Mythos » de Cazenove et Larbier. Exposition « Les petits Mythos » à Montoire-sur-le Loir. Découvrez l’enfance des plus grands acteurs de la mythologie g;2026-04-01;2026-04-30;15:00–19:00;1 - 30 avril;Médiathèque Nef EuropaQuartier Marescot;41800 Montoire-sur-le-Loir;41800;Montoire-sur-le-Loir;47.751889;0.861139;Exposition;;https://cdn.openagenda.com/main/;;Territoires Vendômois;2026-04-07
19545423;exposition-mission-potager-a-savigny-sur-braye;Exposition « Mission potager » à Savigny-sur-Braye;Nouvelle exposition à découvrir dans votre médiathèque ! Exposition « Mission potager » à Savigny-sur-Braye. Exposition ludique et pédagogique pour découvrir les fruits, les légumes et apprendre à les;2026-03-31;2026-04-25;15:00–19:00;31 mars - 25 avril;Médiathèque-Ludothèque Agora Braye;7 Rue Hélène Boucher, 41360 Savigny-sur-Braye;41360;Savigny-sur-Braye;47.880414;0.807572;Exposition;;https://cdn.openagenda.com/main/;;Territoires Vendômois;2026-04-07
98033919;exposition-protegeons-les-oceans-a-selommes;"Exposition ""Protégeons les océans"" à Selommes";"Nouvelle exposition à découvrir dans votre médiathèque. Exposition ""Protégeons les océans"" à Selommes. Découvrez l’exposition « Protégeons les océans » à Selommes et plongez au cœur des enjeux liés à";2026-03-25;2026-04-25;15:00–17:00;25 mars - 25 avril;Médiathèque17 bis;rue Bout de Haies, 41100 Selommes;41100;Selommes;47.753757;1.192781;Exposition;;https://cdn.openagenda.com/main/;;Territoires Vendômois;2026-04-07
70894365;sejours-decriture-a-saint-firmin-des-pres;Séjours d'écriture à Saint-Firmin-des-Prés;Cette école d’écriture, présente depuis plus de 40 ans à Paris, Bordeaux et Lyon, propose, en complément de ses formations régulières, des séjours d’écriture dans plusieurs régions de France, offrant;2026-04-09;2026-06-07;00:00–23:59;9 avril - 7 juin;Le Kampus;6 Route de l'Auseys, 41100 Saint-Firmin-des-Prés;41100;Saint-Firmin-des-Prés;47.841704;1.114055;Littérature;;https://cdn.openagenda.com/main/;;Territoires Vendômois;2026-04-07
32384949;lhectare-plateaux-partages-a-vendome;"L'Hectare ""Plateaux partagés"" à Vendôme";"Education artistique et culturelle. L'Hectare ""Plateaux partagés"" à Vendôme. Les plateaux partagés, c’est la conclusion de plusieurs mois de travail avec de nombreux partenaires du territoire et des a";2026-04-09;2026-04-11;00:00–23:59;9 - 11 avril;Le Minotaure / Théâtre;8 Rue César de Vendôme, 41100 Vendôme;41100;Vendôme;47.791968;1.071734;Festivals | concerts et spectacles;;https://cdn.openagenda.com/main/;;Territoires Vendômois;2026-04-07
10318904;heure-du-conte-des-tout-petits-a-selommes;Heure du conte des tout-petits à Selommes;Petites histoires et grandes émotions. Heure du conte des tout-petits à Selommes. Installez-vous confortablement, laissez votre imagination s'envoler et préparez-vous à découvrir une histoire merveill;2026-04-09;2026-04-09;00:00–23:59;Jeudi 9 avril, 00h00;Médiathèque17B;Rue du Bout des Haies, 41100 Selommes;41100;Selommes;47.75543;1.1925;;;https://cdn.openagenda.com/main/;;Territoires Vendômois;2026-04-07
59835075;cours-de-cuisine-a-loir-en-vallee;Cours de cuisine à Loir-en-Vallée;Un cours de cuisine = un thème différent ! Cour de cuisine à Loir-en-Vallée. Après un cours avec le Chef Mikaël vous serez un cordon bleu à la maison. Vous repartez du cours avec un plat pour 4 person;2026-04-09;2026-04-09;00:00–23:59;Jeudi 9 avril, 00h00;Restaurant au jardin des Saveurs;3 Rue du Val de Braye, 72310 Loir en Vallée;;Loir en Vallée;47.77096;0.70131;Gastronomie;;https://cdn.openagenda.com/main/;;Territoires Vendômois;2026-04-07
73618510;la-jeunesse-bouquine-heure-du-conte-des-tout-petits-5204192;La Jeunesse bouquine - Heure du conte des tout-petits;La Jeunesse bouquine - Heure du conte des tout-petits;2026-04-09;2026-04-09;00:00–23:59;Jeudi 9 avril, 00h00;Médiathèque de Vendôme;Parc Ronsard, 41100 Vendôme;41100;Vendôme;47.792608;1.065549;Heure du conte;;;;Territoires Vendômois;2026-04-07
68613517;participez-au-ptit-dej-de-lemploi-4400687;"Participez au ""p'tit déj de l'emploi"" !";Vous cherchez un emploi ? Venez à la rencontre des secteurs qui recrutent ! Participez au p'tit déj de l'emploi et rencontrez des professionnels de l'emploi, de la formation et de la mobilité.;2026-04-09;2026-04-09;09:00–11:00;Jeudi 9 avril, 09h00;Vendôme - Agence VENDOME;41100 Vendôme, 41100 Vendôme;41100;Vendôme;47.787418;1.071736;['Insertion'];;https://cdn.openagenda.com/main/;;Territoires Vendômois;2026-04-07
88252561;devenez-monteur-cableur-hf-au-sein-de-lentreprise-epsys-a-montoire-recrutement-sans-cv-6657148;Devenez monteur-câbleur h/f au sein de l'entreprise Epsys à Montoire ! Recrutement sans CV !;Participez à une réunion d'informations au sein de l'entreprise EPSYS, filiale du Groupe Cahors, et découvrez une opportunité unique de vous former au métier de monteur-câbleur via une POEI (Prépar;2026-04-09;2026-04-09;09:30–12:00;Jeudi 9 avril, 09h30;Montoire-sur-le-Loir - Agence VENDOME;41800 Montoire-sur-le-Loir, 41800 Montoire-sur-le-Loir;41800;Montoire-sur-le-Loir;47.754547;0.858403;['#TousMobilisés' | 'Recrutement sans CV'];;https://cdn.openagenda.com/main/;;Territoires Vendômois;2026-04-07
2601949;randonnee-en-orientation-a-besse-sur-braye;Randonnée en orientation à Bessé-sur-Braye;Le Sarthe Orient tour fait étape à Bessé sur Braye. Randonnée en orientation à Bessé-sur-Braye. La Rand'Onnée en orientation, organisée par l’association Azimut 72, se déroulera en nocturne le vendred;2026-04-10;2026-04-11;00:00–23:59;10 et 11 avril;Bessé-sur-Braye;Allée des Lions - Château de Courtanvaux, 72310 Bessé-sur-Braye;;Bessé-sur-Braye;47.833387;0.753144;;;https://cdn.openagenda.com/main/;;Territoires Vendômois;2026-04-07
13036862;la-jeunesse-bouquine-les-explorateurs-du-livre-4576195;La jeunesse Bouquine - Les explorateurs du livre;La jeunesse Bouquine - Les explorateurs du livre;2026-04-10;2026-04-10;00:00–23:59;Vendredi 10 avril, 00h00;Médiathèque de Vendôme;Parc Ronsard, 41100 Vendôme;41100;Vendôme;47.792608;1.065549;Club de lecture;;;;Territoires Vendômois;2026-04-07
81456765;concert-de-printemps-2029562;Concert de printemps;Concert de printemps Concert de printemps AVF Vendôme avec les chorales Chœur du Loir et Chanteloire (Amis de la musique de la Chaussée Saint-Victor.;2026-04-10;2026-04-10;00:00–23:59;Vendredi 10 avril, 00h00;Vendôme;47 Rue Poterie, 41100 Vendôme;41100;Vendôme;47.793092;1.065706;Concert;;https://cdn.openagenda.com/main/;;Territoires Vendômois;2026-04-07
80918266;porte-ouverte-a-latelier-de-nyne-a-villiers-sur-loir;Porte ouverte à l'atelier de Nyne à Villiers-sur-Loir;Porte ouverte dans le cadre des journées européennes des métiers d'art... Porte ouverte à l'atelier de Nyne à Villiers-sur-Loir. Nyne est artisan d’art, spécialisée en peinture décorative : customisat;2026-04-10;2026-04-12;10:00–19:00;10 - 12 avril;Atelier de Nyne;102 Avenue Pierre Armand Colin, 41100 Villiers-sur-Loir;41100;Villiers-sur-Loir;47.812351;0.975064;Portes ouvertes;;https://cdn.openagenda.com/main/;;Territoires Vendômois;2026-04-07
90027291;randonnee-historique-w3-quartier-general-allemand-a-saint-rimay;Randonnée historique W3-Quartier Général Allemand à Saint Rimay;Partez sur les marches de l'Histoire pour une randonnée historique de 3h30 pour un parcours de 6km. Randonnée historique W3-Quartier Général Allemand à Saint Rimay. Après l'invasion des pays du nord d;2026-04-11;2026-06-09;00:00–23:59;11 avril - 9 juin;Départ du Tunnel (côté Montoire);7 rue du Tunnel, 41800 Saint-Rimay;41800;Saint-Rimay;47.768265;0.917141;Randonnées et sorties nature;;https://cdn.openagenda.com/main/;;Territoires Vendômois;2026-04-07
21200463;sortie-plantes-sauvages-comestibles-de-sous-bois-au-plessis-dorin;Sortie plantes sauvages comestibles de sous-bois au Plessis Dorin;Balade nature pour en savoir plus sur les plantes sauvages comestibles. Sortie plantes sauvages comestibles de sous-bois au Plessis Dorin. Cette sortie de terrain se veut comme une immersion en sous-b;2026-04-11;2026-04-11;00:00–23:59;Samedi 11 avril, 00h00;Domaine de Boisvinet;41170 Le Plessis-Dorin;41170;Le Plessis-Dorin;48.072365;0.880296;Randonnées et sorties nature;;https://cdn.openagenda.com/main/;;Territoires Vendômois;2026-04-07
27587276;partage-de-lectures-1926633;Partage de lectures;Partage de lectures;2026-04-11;2026-04-11;00:00–23:59;Samedi 11 avril, 00h00;Médiathèque de Vendôme;Parc Ronsard, 41100 Vendôme;41100;Vendôme;47.792608;1.065549;Club de lecture;;;;Territoires Vendômois;2026-04-07
78780489;partage-de-lecture-a-selommes-7734408;Partage de lecture à Selommes;Passionnés de lecture ou pas ? Partage de lecture à Selommes. Venez passer un moment d'échanges, de débats et de partage. Chaque participant apporte et présente son livre : roman, poésie, BD. Tous les;2026-04-11;2026-04-11;00:00–23:59;Samedi 11 avril, 00h00;Médiathèque17 bis;rue Bout de Haies, 41100 Selommes;41100;Selommes;47.753757;1.192781;Littérature;;https://cdn.openagenda.com/main/;;Territoires Vendômois;2026-04-07
